leelaz_opencl_tuning
0;XgemmBatched;192;256;192;16; -DKWG=32 -DKWI=2 -DMDIMA=16 -DMDIMC=16 -DMWG=64 -DNDIMB=8 -DNDIMC=8 -DNWG=64 -DSA=1 -DSB=1 -DSTRM=0 -DSTRN=0 -DVWM=4 -DVWN=2;OpenCL: Advanced Micro Devices, Inc. gfx902 @ 1200MHz
